{
  "$schema": "https://json-schema.org/draft-07/schema#",
  "$id": "https://oh-my-tradeagent/schemas/watchlist-mirror-payload.json",
  "title": "WatchlistMirrorPayload",
  "description": "Verbatim daily watchlist message mirrored from Discord by signal-source-discord and consumed by WatchlistMirrorWorkflow. Carries the raw watchlist text for the ET calendar date plus dedupe provenance (source_message_id). No parsing/structuring is performed here — downstream consumers interpret raw_text. Reference: docs/plans/PLAN-watchlist-mirror.html.",
  "type": "object",
  "javaType": "com.ohmytradeagent.contract.WatchlistMirrorPayload",
  "additionalProperties": false,
  "required": [
    "schema_version",
    "tenant_id",
    "strategy_id",
    "et_date",
    "author",
    "raw_text",
    "source_message_id"
  ],
  "properties": {
    "schema_version": {
      "type": "integer",
      "description": "DTO contract version. See CopytradeSignalPayload.schema_version. Start at 1; bump on non-backward-compatible field changes.",
      "minimum": 1
    },
    "tenant_id": {
      "type": "string",
      "minLength": 1,
      "description": "Tenant scope key. Required on every Activity payload and workflow input."
    },
    "strategy_id": {
      "type": "string",
      "minLength": 1,
      "description": "Strategy scope key within the tenant."
    },
    "et_date": {
      "type": "string",
      "format": "date",
      "description": "ET calendar date of the watchlist (YYYY-MM-DD, e.g. '2026-06-03'). The America/New_York wall-clock date the message belongs to — NOT a timestamp. Kept as a plain date to avoid timezone/offset ambiguity at the wire boundary. Named et_date (not date) to avoid shadowing the date type in generated models."
    },
    "author": {
      "type": "string",
      "minLength": 1,
      "description": "Discord username that posted the watchlist message."
    },
    "raw_text": {
      "type": "string",
      "minLength": 1,
      "description": "The verbatim watchlist message body as read from Discord, unmodified. Length intentionally unconstrained (multi-line watchlists vary widely)."
    },
    "source_message_id": {
      "type": "string",
      "minLength": 1,
      "description": "Discord message id the watchlist was read from; the dedupe key alongside WorkflowIDReusePolicy.REJECT_DUPLICATE."
    }
  }
}
